{
  "planId": "e4-ontology-entity",
  "moduleName": "controleEstoque2",
  "reviewRound": 1,
  "entityId": "Product",
  "fields": [
    {
      "fieldId": "productId",
      "title": "Identificador do produto",
      "type": "uuid",
      "required": true,
      "description": "Identificador estável do produto no catálogo da organização, usado como referência nas movimentações e consultas de saldo.",
      "constraints": [
        {
          "constraintId": "uniqueProductId",
          "kind": "unique",
          "value": "true",
          "description": "Cada produto possui um identificador estável exclusivo.",
          "source": "inferred"
        }
      ]
    },
    {
      "fieldId": "minimumStock",
      "title": "Estoque mínimo",
      "type": "number",
      "required": true,
      "description": "Quantidade mínima cadastrada para o produto, usada para identificar saldos abaixo do mínimo.",
      "constraints": []
    }
  ],
  "useRules": [
    "lowStockAlertThreshold"
  ]
}
